<?xml version="1.0" encoding="UTF-8"?>

<!--
   Copyright 2013, Emanuel Rabina (http://www.ultraq.net.nz/)

   Licensed under the Apache License, Version 2.0 (the "License");
   you may not use this file except in compliance with the License.
   You may obtain a copy of the License at

       http://www.apache.org/licenses/LICENSE-2.0

   Unless required by applicable law or agreed to in writing, software
   distributed under the License is distributed on an "AS IS" BASIS,
   WITHOUT WARRANTIES OR CONDITIONS OF ANY KIND, either express or implied.
   See the License for the specific language governing permissions and
   limitations under the License.
-->

<xsd:schema targetNamespace="http://www.ultraq.net.nz/eclipse/thymeleaf-dialect"
	xmlns="http://www.ultraq.net.nz/eclipse/thymeleaf-dialect"
	xmlns:ci="http://jaxb.dev.java.net/plugin/code-injector"
	xmlns:jxb="http://java.sun.com/xml/ns/jaxb" jxb:extensionBindingPrefixes="ci" jxb:version="1.0"
	xmlns:xsd="http://www.w3.org/2001/XMLSchema" elementFormDefault="qualified">

	<!-- Map schema to custom package -->
	<xsd:annotation>
		<xsd:appinfo>
			<jxb:schemaBindings>
				<jxb:package name="nz.net.ultraq.eclipse.thymeleaf.xml"/>
			</jxb:schemaBindings>
		</xsd:appinfo>
	</xsd:annotation>

	<!-- Root element, the dialect -->
	<xsd:element name="dialect">
		<xsd:complexType>
			<xsd:sequence>
				<xsd:choice maxOccurs="unbounded">
					<xsd:annotation>
						<xsd:appinfo>
							<jxb:property name="processors"/>
						</xsd:appinfo>
					</xsd:annotation>
					<xsd:element name="attribute-processor" type="AttributeProcessor"/>
					<xsd:element name="element-processor" type="ElementProcessor"/>
				</xsd:choice>
			</xsd:sequence>
			<xsd:attribute name="prefix" type="xsd:string" use="required"/>
			<xsd:attribute name="namespace-uri" type="xsd:anyURI" use="required"/>
		</xsd:complexType>
	</xsd:element>

	<!-- Processor types -->
	<xsd:complexType name="Processor" abstract="true">
		<xsd:annotation>
			<xsd:appinfo>
				<ci:code>
	@javax.xml.bind.annotation.XmlTransient
	protected Dialect dialect;

	/**
	 * Gets the dialect this processor belongs to.
	 * 
	 * @return Dialect this processor is for.
	 */
	public Dialect getDialect() {

		return dialect;
	}

	/**
	 * Set the dialect this processor belongs to.
	 * 
	 * @param dialect
	 */
	public void setDialect(Dialect dialect) {

		this.dialect = dialect;
	}
				</ci:code>
			</xsd:appinfo>
		</xsd:annotation>
		<xsd:attribute name="name" type="xsd:string" use="required"/>
	</xsd:complexType>
	<xsd:complexType name="AttributeProcessor">
		<xsd:complexContent>
			<xsd:extension base="Processor"/>
		</xsd:complexContent>
	</xsd:complexType>
	<xsd:complexType name="ElementProcessor">
		<xsd:complexContent>
			<xsd:extension base="Processor"/>
		</xsd:complexContent>
	</xsd:complexType>

</xsd:schema>
